-- disable ORCA
SET optimizer TO off;
create schema matview_data_schema;
set search_path to matview_data_schema;
create table t1(a int, b int);
NOTICE:  Table doesn't have 'DISTRIBUTED BY' clause -- Using column named 'a' as the Apache Cloudberry data distribution key for this table.
HINT:  The 'DISTRIBUTED BY' clause determines the distribution of data. Make sure column(s) chosen are the optimal data distribution key to minimize skew.
create table t2(a int, b int);
NOTICE:  Table doesn't have 'DISTRIBUTED BY' clause -- Using column named 'a' as the Apache Cloudberry data distribution key for this table.
HINT:  The 'DISTRIBUTED BY' clause determines the distribution of data. Make sure column(s) chosen are the optimal data distribution key to minimize skew.
insert into t1 select i, i+1 from generate_series(1, 5) i;
insert into t1 select i, i+1 from generate_series(1, 3) i;
create materialized view mv0 as select * from t1;
NOTICE:  Table doesn't have 'DISTRIBUTED BY' clause -- Using column(s) named 'a' as the Apache Cloudberry data distribution key for this table.
HINT:  The 'DISTRIBUTED BY' clause determines the distribution of data. Make sure column(s) chosen are the optimal data distribution key to minimize skew.
create materialized view mv1 as select a, count(*), sum(b) from t1 group by a;
NOTICE:  Table doesn't have 'DISTRIBUTED BY' clause -- Using column(s) named 'a' as the Apache Cloudberry data distribution key for this table.
HINT:  The 'DISTRIBUTED BY' clause determines the distribution of data. Make sure column(s) chosen are the optimal data distribution key to minimize skew.
create materialized view mv2 as select * from t2;
NOTICE:  Table doesn't have 'DISTRIBUTED BY' clause -- Using column(s) named 'a' as the Apache Cloudberry data distribution key for this table.
HINT:  The 'DISTRIBUTED BY' clause determines the distribution of data. Make sure column(s) chosen are the optimal data distribution key to minimize skew.
-- all mv are up to date
select mvname, datastatus from gp_matview_aux where mvname in ('mv0','mv1', 'mv2');
 mvname | datastatus 
--------+------------
 mv0    | u
 mv1    | u
 mv2    | u
(3 rows)

-- truncate in self transaction
begin;
create table t3(a int, b int);
NOTICE:  Table doesn't have 'DISTRIBUTED BY' clause -- Using column named 'a' as the Apache Cloudberry data distribution key for this table.
HINT:  The 'DISTRIBUTED BY' clause determines the distribution of data. Make sure column(s) chosen are the optimal data distribution key to minimize skew.
create materialized view mv3 as select * from t3;
NOTICE:  Table doesn't have 'DISTRIBUTED BY' clause -- Using column(s) named 'a' as the Apache Cloudberry data distribution key for this table.
HINT:  The 'DISTRIBUTED BY' clause determines the distribution of data. Make sure column(s) chosen are the optimal data distribution key to minimize skew.
select datastatus from gp_matview_aux where mvname = 'mv3';
 datastatus 
------------
 u
(1 row)

truncate t3;
select datastatus from gp_matview_aux where mvname = 'mv3';
 datastatus 
------------
 e
(1 row)

end;
-- trcuncate
refresh materialized view mv3;
select datastatus from gp_matview_aux where mvname = 'mv3';
 datastatus 
------------
 u
(1 row)

truncate t3;
select datastatus from gp_matview_aux where mvname = 'mv3';
 datastatus 
------------
 e
(1 row)

-- insert and refresh
select datastatus from gp_matview_aux where mvname = 'mv0';
 datastatus 
------------
 u
(1 row)

select datastatus from gp_matview_aux where mvname = 'mv1';
 datastatus 
------------
 u
(1 row)

insert into t1 values (1, 2); 
select datastatus from gp_matview_aux where mvname = 'mv0';
 datastatus 
------------
 i
(1 row)

select datastatus from gp_matview_aux where mvname = 'mv1';
 datastatus 
------------
 i
(1 row)

-- insert but no rows changes
refresh materialized view mv0;
refresh materialized view mv1;
select datastatus from gp_matview_aux where mvname = 'mv0';
 datastatus 
------------
 u
(1 row)

select datastatus from gp_matview_aux where mvname = 'mv1';
 datastatus 
------------
 u
(1 row)

insert into t1 select * from t3; 
select datastatus from gp_matview_aux where mvname = 'mv0';
 datastatus 
------------
 u
(1 row)

select datastatus from gp_matview_aux where mvname = 'mv1';
 datastatus 
------------
 u
(1 row)

-- update
refresh materialized view mv0;
refresh materialized view mv1;
select datastatus from gp_matview_aux where mvname = 'mv0';
 datastatus 
------------
 u
(1 row)

select datastatus from gp_matview_aux where mvname = 'mv1';
 datastatus 
------------
 u
(1 row)

update t1 set a = 10 where a = 1;
select datastatus from gp_matview_aux where mvname = 'mv0';
 datastatus 
------------
 e
(1 row)

select datastatus from gp_matview_aux where mvname = 'mv1';
 datastatus 
------------
 e
(1 row)

-- delete
refresh materialized view mv0;
refresh materialized view mv1;
select datastatus from gp_matview_aux where mvname = 'mv0';
 datastatus 
------------
 u
(1 row)

select datastatus from gp_matview_aux where mvname = 'mv1';
 datastatus 
------------
 u
(1 row)

delete from t1 where a = 10;
select datastatus from gp_matview_aux where mvname = 'mv0';
 datastatus 
------------
 e
(1 row)

select datastatus from gp_matview_aux where mvname = 'mv1';
 datastatus 
------------
 e
(1 row)

-- vacuum
refresh materialized view mv0;
refresh materialized view mv1;
select datastatus from gp_matview_aux where mvname = 'mv0';
 datastatus 
------------
 u
(1 row)

select datastatus from gp_matview_aux where mvname = 'mv1';
 datastatus 
------------
 u
(1 row)

vacuum t1;
select datastatus from gp_matview_aux where mvname = 'mv0';
 datastatus 
------------
 u
(1 row)

select datastatus from gp_matview_aux where mvname = 'mv1';
 datastatus 
------------
 u
(1 row)

vacuum full t1;
select datastatus from gp_matview_aux where mvname = 'mv0';
 datastatus 
------------
 r
(1 row)

select datastatus from gp_matview_aux where mvname = 'mv1';
 datastatus 
------------
 r
(1 row)

-- insert after vacuum full 
insert into t1 values(1, 2);
select datastatus from gp_matview_aux where mvname = 'mv0';
 datastatus 
------------
 e
(1 row)

select datastatus from gp_matview_aux where mvname = 'mv1';
 datastatus 
------------
 e
(1 row)

-- vacuum full after insert
refresh materialized view mv0;
refresh materialized view mv1;
select datastatus from gp_matview_aux where mvname = 'mv0';
 datastatus 
------------
 u
(1 row)

select datastatus from gp_matview_aux where mvname = 'mv1';
 datastatus 
------------
 u
(1 row)

insert into t1 values(1, 2);
select datastatus from gp_matview_aux where mvname = 'mv0';
 datastatus 
------------
 i
(1 row)

select datastatus from gp_matview_aux where mvname = 'mv1';
 datastatus 
------------
 i
(1 row)

vacuum full t1;
select datastatus from gp_matview_aux where mvname = 'mv0';
 datastatus 
------------
 e
(1 row)

select datastatus from gp_matview_aux where mvname = 'mv1';
 datastatus 
------------
 e
(1 row)

-- Refresh With No Data
refresh materialized view mv2;
select datastatus from gp_matview_aux where mvname = 'mv2';
 datastatus 
------------
 u
(1 row)

refresh materialized view mv2 with no data;
select datastatus from gp_matview_aux where mvname = 'mv2';
 datastatus 
------------
 e
(1 row)

-- Copy
refresh materialized view mv2;
select datastatus from gp_matview_aux where mvname = 'mv2';
 datastatus 
------------
 u
(1 row)

-- 0 rows
COPY t2 from stdin;
select datastatus from gp_matview_aux where mvname = 'mv2';
 datastatus 
------------
 u
(1 row)

COPY t2 from stdin;
select datastatus from gp_matview_aux where mvname = 'mv2';
 datastatus 
------------
 i
(1 row)

--
-- test issue https://github.com/apache/cloudberry/issues/582
-- test inherits
--
begin;
create table tp_issue_582(i int, j int);
NOTICE:  Table doesn't have 'DISTRIBUTED BY' clause -- Using column named 'i' as the Apache Cloudberry data distribution key for this table.
HINT:  The 'DISTRIBUTED BY' clause determines the distribution of data. Make sure column(s) chosen are the optimal data distribution key to minimize skew.
create table tc_issue_582(i int) inherits (tp_issue_582);
NOTICE:  table has parent, setting distribution columns to match parent table
NOTICE:  merging column "i" with inherited definition
insert into tp_issue_582 values(1, 1), (2, 2);
insert into tc_issue_582 values(1, 1);
create materialized view mv_tp_issue_582 as select * from tp_issue_582;
NOTICE:  Table doesn't have 'DISTRIBUTED BY' clause -- Using column(s) named 'i' as the Apache Cloudberry data distribution key for this table.
HINT:  The 'DISTRIBUTED BY' clause determines the distribution of data. Make sure column(s) chosen are the optimal data distribution key to minimize skew.
-- should be null.
select mvname, datastatus from gp_matview_aux where mvname = 'mv_tp_issue_582';
 mvname | datastatus 
--------+------------
(0 rows)

abort;
--
-- Test multi-table JOIN materialized views
--
create table jt1(id int, val int);
NOTICE:  Table doesn't have 'DISTRIBUTED BY' clause -- Using column named 'id' as the Apache Cloudberry data distribution key for this table.
HINT:  The 'DISTRIBUTED BY' clause determines the distribution of data. Make sure column(s) chosen are the optimal data distribution key to minimize skew.
create table jt2(id int, val int);
NOTICE:  Table doesn't have 'DISTRIBUTED BY' clause -- Using column named 'id' as the Apache Cloudberry data distribution key for this table.
HINT:  The 'DISTRIBUTED BY' clause determines the distribution of data. Make sure column(s) chosen are the optimal data distribution key to minimize skew.
create table jt3(id int, val int);
NOTICE:  Table doesn't have 'DISTRIBUTED BY' clause -- Using column named 'id' as the Apache Cloudberry data distribution key for this table.
HINT:  The 'DISTRIBUTED BY' clause determines the distribution of data. Make sure column(s) chosen are the optimal data distribution key to minimize skew.
insert into jt1 select i, i*10 from generate_series(1,5) i;
insert into jt2 select i, i*100 from generate_series(1,5) i;
insert into jt3 select i, i*1000 from generate_series(1,5) i;
-- Two-table INNER JOIN: verify registration
create materialized view mv_join2 as
  select jt1.id, jt1.val as v1, jt2.val as v2
  from jt1 join jt2 on jt1.id = jt2.id;
NOTICE:  Table doesn't have 'DISTRIBUTED BY' clause -- Using column(s) named 'id' as the Apache Cloudberry data distribution key for this table.
HINT:  The 'DISTRIBUTED BY' clause determines the distribution of data. Make sure column(s) chosen are the optimal data distribution key to minimize skew.
select mvname, datastatus from gp_matview_aux where mvname = 'mv_join2';
  mvname  | datastatus 
----------+------------
 mv_join2 | u
(1 row)

select count(*) from gp_matview_tables mt
  join pg_class c on mt.relid = c.oid
  where mt.mvoid = 'mv_join2'::regclass;
 count 
-------
     2
(1 row)

-- INSERT on table A: status -> 'i'
insert into jt1 values(6, 60);
select mvname, datastatus from gp_matview_aux where mvname = 'mv_join2';
  mvname  | datastatus 
----------+------------
 mv_join2 | i
(1 row)

-- REFRESH: status -> 'u'
refresh materialized view mv_join2;
select mvname, datastatus from gp_matview_aux where mvname = 'mv_join2';
  mvname  | datastatus 
----------+------------
 mv_join2 | u
(1 row)

-- INSERT on table B: status -> 'i'
insert into jt2 values(7, 700);
select mvname, datastatus from gp_matview_aux where mvname = 'mv_join2';
  mvname  | datastatus 
----------+------------
 mv_join2 | i
(1 row)

-- UPDATE on table A: status -> 'e'
refresh materialized view mv_join2;
update jt1 set val = 99 where id = 1;
select mvname, datastatus from gp_matview_aux where mvname = 'mv_join2';
  mvname  | datastatus 
----------+------------
 mv_join2 | e
(1 row)

-- DELETE on table B: status -> 'e'
refresh materialized view mv_join2;
delete from jt2 where id = 7;
select mvname, datastatus from gp_matview_aux where mvname = 'mv_join2';
  mvname  | datastatus 
----------+------------
 mv_join2 | e
(1 row)

-- Implicit join (FROM t1, t2 WHERE ...): verify registration
refresh materialized view mv_join2;
create materialized view mv_implicit_join as
  select jt1.id, jt1.val as v1, jt2.val as v2
  from jt1, jt2 where jt1.id = jt2.id;
NOTICE:  Table doesn't have 'DISTRIBUTED BY' clause -- Using column(s) named 'id' as the Apache Cloudberry data distribution key for this table.
HINT:  The 'DISTRIBUTED BY' clause determines the distribution of data. Make sure column(s) chosen are the optimal data distribution key to minimize skew.
select mvname, datastatus from gp_matview_aux where mvname = 'mv_implicit_join';
      mvname      | datastatus 
------------------+------------
 mv_implicit_join | u
(1 row)

select count(*) from gp_matview_tables mt
  join pg_class c on mt.relid = c.oid
  where mt.mvoid = 'mv_implicit_join'::regclass;
 count 
-------
     2
(1 row)

-- Three-table join: verify 3 entries in gp_matview_tables
create materialized view mv_join3 as
  select jt1.id, jt1.val as v1, jt2.val as v2, jt3.val as v3
  from jt1 join jt2 on jt1.id = jt2.id join jt3 on jt2.id = jt3.id;
NOTICE:  Table doesn't have 'DISTRIBUTED BY' clause -- Using column(s) named 'id' as the Apache Cloudberry data distribution key for this table.
HINT:  The 'DISTRIBUTED BY' clause determines the distribution of data. Make sure column(s) chosen are the optimal data distribution key to minimize skew.
select mvname, datastatus from gp_matview_aux where mvname = 'mv_join3';
  mvname  | datastatus 
----------+------------
 mv_join3 | u
(1 row)

select count(*) from gp_matview_tables mt
  join pg_class c on mt.relid = c.oid
  where mt.mvoid = 'mv_join3'::regclass;
 count 
-------
     3
(1 row)

-- DML on middle table expires mv_join3
insert into jt2 values(8, 800);
select mvname, datastatus from gp_matview_aux where mvname = 'mv_join3';
  mvname  | datastatus 
----------+------------
 mv_join3 | i
(1 row)

-- Self-join: verify only 1 entry in gp_matview_tables
create materialized view mv_selfjoin as
  select a.id as aid, b.id as bid
  from jt1 a join jt1 b on a.id = b.id;
NOTICE:  Table doesn't have 'DISTRIBUTED BY' clause -- Using column(s) named 'aid' as the Apache Cloudberry data distribution key for this table.
HINT:  The 'DISTRIBUTED BY' clause determines the distribution of data. Make sure column(s) chosen are the optimal data distribution key to minimize skew.
select mvname, datastatus from gp_matview_aux where mvname = 'mv_selfjoin';
   mvname    | datastatus 
-------------+------------
 mv_selfjoin | u
(1 row)

select count(*) from gp_matview_tables mt
  join pg_class c on mt.relid = c.oid
  where mt.mvoid = 'mv_selfjoin'::regclass;
 count 
-------
     1
(1 row)

-- LEFT/RIGHT/FULL OUTER JOIN: verify all register correctly
create materialized view mv_left_join as
  select jt1.id, jt1.val as v1, jt2.val as v2
  from jt1 left join jt2 on jt1.id = jt2.id;
NOTICE:  Table doesn't have 'DISTRIBUTED BY' clause -- Using column(s) named 'id' as the Apache Cloudberry data distribution key for this table.
HINT:  The 'DISTRIBUTED BY' clause determines the distribution of data. Make sure column(s) chosen are the optimal data distribution key to minimize skew.
select mvname, datastatus from gp_matview_aux where mvname = 'mv_left_join';
    mvname    | datastatus 
--------------+------------
 mv_left_join | u
(1 row)

create materialized view mv_right_join as
  select jt1.id, jt2.val as v2
  from jt1 right join jt2 on jt1.id = jt2.id;
NOTICE:  Table doesn't have 'DISTRIBUTED BY' clause -- Using column(s) named 'id' as the Apache Cloudberry data distribution key for this table.
HINT:  The 'DISTRIBUTED BY' clause determines the distribution of data. Make sure column(s) chosen are the optimal data distribution key to minimize skew.
select mvname, datastatus from gp_matview_aux where mvname = 'mv_right_join';
    mvname     | datastatus 
---------------+------------
 mv_right_join | u
(1 row)

create materialized view mv_full_join as
  select jt1.id as id1, jt2.id as id2
  from jt1 full join jt2 on jt1.id = jt2.id;
NOTICE:  Table doesn't have 'DISTRIBUTED BY' clause -- Using column(s) named 'id1' as the Apache Cloudberry data distribution key for this table.
HINT:  The 'DISTRIBUTED BY' clause determines the distribution of data. Make sure column(s) chosen are the optimal data distribution key to minimize skew.
select mvname, datastatus from gp_matview_aux where mvname = 'mv_full_join';
    mvname    | datastatus 
--------------+------------
 mv_full_join | u
(1 row)

-- Partitioned table in join: verify partition DML propagates
create table jt_par(a int, b int) partition by range(a)
  (start(1) end(3) every(1));
NOTICE:  Table doesn't have 'DISTRIBUTED BY' clause -- Using column named 'a' as the Apache Cloudberry data distribution key for this table.
HINT:  The 'DISTRIBUTED BY' clause determines the distribution of data. Make sure column(s) chosen are the optimal data distribution key to minimize skew.
insert into jt_par values(1, 10), (2, 20);
create materialized view mv_join_par as
  select jt1.id, jt1.val as v1, jt_par.a, jt_par.b
  from jt1 join jt_par on jt1.id = jt_par.a;
NOTICE:  Table doesn't have 'DISTRIBUTED BY' clause -- Using column(s) named 'id' as the Apache Cloudberry data distribution key for this table.
HINT:  The 'DISTRIBUTED BY' clause determines the distribution of data. Make sure column(s) chosen are the optimal data distribution key to minimize skew.
select mvname, datastatus from gp_matview_aux where mvname = 'mv_join_par';
   mvname    | datastatus 
-------------+------------
 mv_join_par | u
(1 row)

insert into jt_par values(1, 11);
select mvname, datastatus from gp_matview_aux where mvname = 'mv_join_par';
   mvname    | datastatus 
-------------+------------
 mv_join_par | i
(1 row)

refresh materialized view mv_join_par;
insert into jt1 values(9, 90);
select mvname, datastatus from gp_matview_aux where mvname = 'mv_join_par';
   mvname    | datastatus 
-------------+------------
 mv_join_par | i
(1 row)

-- VACUUM FULL on one base table of a join MV: status -> 'r'
refresh materialized view mv_join2;
select mvname, datastatus from gp_matview_aux where mvname = 'mv_join2';
  mvname  | datastatus 
----------+------------
 mv_join2 | u
(1 row)

vacuum full jt1;
select mvname, datastatus from gp_matview_aux where mvname = 'mv_join2';
  mvname  | datastatus 
----------+------------
 mv_join2 | r
(1 row)

-- TRUNCATE on one base table of a join MV: status -> 'e'
refresh materialized view mv_join2;
truncate jt2;
select mvname, datastatus from gp_matview_aux where mvname = 'mv_join2';
  mvname  | datastatus 
----------+------------
 mv_join2 | e
(1 row)

-- CREATE WITH NO DATA: status -> 'e'
create materialized view mv_join_nodata as
  select jt1.id, jt3.val from jt1 join jt3 on jt1.id = jt3.id
  with no data;
NOTICE:  Table doesn't have 'DISTRIBUTED BY' clause -- Using column(s) named 'id' as the Apache Cloudberry data distribution key for this table.
HINT:  The 'DISTRIBUTED BY' clause determines the distribution of data. Make sure column(s) chosen are the optimal data distribution key to minimize skew.
select mvname, datastatus from gp_matview_aux where mvname = 'mv_join_nodata';
     mvname     | datastatus 
----------------+------------
 mv_join_nodata | e
(1 row)

-- DROP CASCADE: matview and aux entries removed
drop materialized view mv_join_nodata;
select count(*) from gp_matview_aux where mvname = 'mv_join_nodata';
 count 
-------
     0
(1 row)

-- Mixed join types in one view (INNER + LEFT)
create materialized view mv_mixed_join as
  select jt1.id, jt2.val as v2, jt3.val as v3
  from jt1 join jt2 on jt1.id = jt2.id left join jt3 on jt2.id = jt3.id;
NOTICE:  Table doesn't have 'DISTRIBUTED BY' clause -- Using column(s) named 'id' as the Apache Cloudberry data distribution key for this table.
HINT:  The 'DISTRIBUTED BY' clause determines the distribution of data. Make sure column(s) chosen are the optimal data distribution key to minimize skew.
select mvname, datastatus from gp_matview_aux where mvname = 'mv_mixed_join';
    mvname     | datastatus 
---------------+------------
 mv_mixed_join | u
(1 row)

select count(*) from gp_matview_tables mt
  join pg_class c on mt.relid = c.oid
  where mt.mvoid = 'mv_mixed_join'::regclass;
 count 
-------
     3
(1 row)

-- Join with GROUP BY and aggregates
create materialized view mv_join_agg as
  select jt1.id, count(*) as cnt, sum(jt2.val) as total
  from jt1 join jt2 on jt1.id = jt2.id group by jt1.id;
NOTICE:  Table doesn't have 'DISTRIBUTED BY' clause -- Using column(s) named 'id' as the Apache Cloudberry data distribution key for this table.
HINT:  The 'DISTRIBUTED BY' clause determines the distribution of data. Make sure column(s) chosen are the optimal data distribution key to minimize skew.
select mvname, datastatus from gp_matview_aux where mvname = 'mv_join_agg';
   mvname    | datastatus 
-------------+------------
 mv_join_agg | u
(1 row)

select count(*) from gp_matview_tables mt
  join pg_class c on mt.relid = c.oid
  where mt.mvoid = 'mv_join_agg'::regclass;
 count 
-------
     2
(1 row)

-- Multiple MVs sharing base tables: DML on one table affects all dependent MVs
refresh materialized view mv_join2;
refresh materialized view mv_join3;
refresh materialized view mv_mixed_join;
refresh materialized view mv_join_agg;
select mvname, datastatus from gp_matview_aux
  where mvname in ('mv_join2', 'mv_join3', 'mv_mixed_join', 'mv_join_agg')
  order by mvname;
    mvname     | datastatus 
---------------+------------
 mv_join2      | u
 mv_join3      | u
 mv_join_agg   | u
 mv_mixed_join | u
(4 rows)

insert into jt2 values(10, 1000);
-- all four share jt2 as a base table
select mvname, datastatus from gp_matview_aux
  where mvname in ('mv_join2', 'mv_join3', 'mv_mixed_join', 'mv_join_agg')
  order by mvname;
    mvname     | datastatus 
---------------+------------
 mv_join2      | i
 mv_join3      | i
 mv_join_agg   | i
 mv_mixed_join | i
(4 rows)

-- Transaction: multiple DML on different base tables
refresh materialized view mv_join3;
begin;
select mvname, datastatus from gp_matview_aux where mvname = 'mv_join3';
  mvname  | datastatus 
----------+------------
 mv_join3 | u
(1 row)

insert into jt1 values(20, 200);
-- after insert: 'i' (insert-only)
select mvname, datastatus from gp_matview_aux where mvname = 'mv_join3';
  mvname  | datastatus 
----------+------------
 mv_join3 | i
(1 row)

delete from jt2 where id = 10;
-- after delete: escalates to 'e' (expired)
select mvname, datastatus from gp_matview_aux where mvname = 'mv_join3';
  mvname  | datastatus 
----------+------------
 mv_join3 | e
(1 row)

end;
-- committed: status persists as 'e'
select mvname, datastatus from gp_matview_aux where mvname = 'mv_join3';
  mvname  | datastatus 
----------+------------
 mv_join3 | e
(1 row)

-- Transaction rollback: status should revert
refresh materialized view mv_join3;
select mvname, datastatus from gp_matview_aux where mvname = 'mv_join3';
  mvname  | datastatus 
----------+------------
 mv_join3 | u
(1 row)

begin;
update jt1 set val = 999 where id = 1;
select mvname, datastatus from gp_matview_aux where mvname = 'mv_join3';
  mvname  | datastatus 
----------+------------
 mv_join3 | e
(1 row)

abort;
-- after rollback: back to 'u'
select mvname, datastatus from gp_matview_aux where mvname = 'mv_join3';
  mvname  | datastatus 
----------+------------
 mv_join3 | u
(1 row)

-- Transaction: insert then insert on different tables stays 'i'
refresh materialized view mv_join2;
begin;
insert into jt1 values(30, 300);
select mvname, datastatus from gp_matview_aux where mvname = 'mv_join2';
  mvname  | datastatus 
----------+------------
 mv_join2 | i
(1 row)

insert into jt2 values(31, 3100);
-- still 'i' since both are inserts
select mvname, datastatus from gp_matview_aux where mvname = 'mv_join2';
  mvname  | datastatus 
----------+------------
 mv_join2 | i
(1 row)

abort;
-- Cross join (FROM t1, t2 with no WHERE): verify registration
create materialized view mv_cross_join as
  select jt1.id as id1, jt2.id as id2 from jt1, jt2;
NOTICE:  Table doesn't have 'DISTRIBUTED BY' clause -- Using column(s) named 'id2' as the Apache Cloudberry data distribution key for this table.
HINT:  The 'DISTRIBUTED BY' clause determines the distribution of data. Make sure column(s) chosen are the optimal data distribution key to minimize skew.
select mvname, datastatus from gp_matview_aux where mvname = 'mv_cross_join';
    mvname     | datastatus 
---------------+------------
 mv_cross_join | u
(1 row)

select count(*) from gp_matview_tables mt
  join pg_class c on mt.relid = c.oid
  where mt.mvoid = 'mv_cross_join'::regclass;
 count 
-------
     2
(1 row)

-- Drop base table CASCADE removes dependent join MVs and aux entries
create table jt_drop(id int, val int);
NOTICE:  Table doesn't have 'DISTRIBUTED BY' clause -- Using column named 'id' as the Apache Cloudberry data distribution key for this table.
HINT:  The 'DISTRIBUTED BY' clause determines the distribution of data. Make sure column(s) chosen are the optimal data distribution key to minimize skew.
insert into jt_drop values(1, 10);
create materialized view mv_join_drop as
  select jt1.id, jt_drop.val from jt1 join jt_drop on jt1.id = jt_drop.id;
NOTICE:  Table doesn't have 'DISTRIBUTED BY' clause -- Using column(s) named 'id' as the Apache Cloudberry data distribution key for this table.
HINT:  The 'DISTRIBUTED BY' clause determines the distribution of data. Make sure column(s) chosen are the optimal data distribution key to minimize skew.
select mvname, datastatus from gp_matview_aux where mvname = 'mv_join_drop';
    mvname    | datastatus 
--------------+------------
 mv_join_drop | u
(1 row)

drop table jt_drop cascade;
NOTICE:  drop cascades to materialized view mv_join_drop
select count(*) from gp_matview_aux where mvname = 'mv_join_drop';
 count 
-------
     0
(1 row)

-- Clean up join test objects
drop materialized view mv_cross_join;
drop materialized view mv_join_agg;
drop materialized view mv_mixed_join;
drop materialized view mv_join_par;
drop table jt_par cascade;
drop materialized view mv_full_join;
drop materialized view mv_right_join;
drop materialized view mv_left_join;
drop materialized view mv_selfjoin;
drop materialized view mv_join3;
drop materialized view mv_implicit_join;
drop materialized view mv_join2;
drop table jt3;
drop table jt2;
drop table jt1;
-- test drop table
select mvname, datastatus from gp_matview_aux where mvname in ('mv0','mv1', 'mv2', 'mv3');
 mvname | datastatus 
--------+------------
 mv3    | e
 mv0    | e
 mv1    | e
 mv2    | i
(4 rows)

drop materialized view mv2;
drop table t1 cascade;
NOTICE:  drop cascades to 2 other objects
DETAIL:  drop cascades to materialized view mv0
drop cascades to materialized view mv1
select mvname, datastatus from gp_matview_aux where mvname in ('mv0','mv1', 'mv2', 'mv3');
 mvname | datastatus 
--------+------------
 mv3    | e
(1 row)

--
-- test issue https://github.com/apache/cloudberry/issues/582
-- test rules
begin;
create table t1_issue_582(i int, j int);
NOTICE:  Table doesn't have 'DISTRIBUTED BY' clause -- Using column named 'i' as the Apache Cloudberry data distribution key for this table.
HINT:  The 'DISTRIBUTED BY' clause determines the distribution of data. Make sure column(s) chosen are the optimal data distribution key to minimize skew.
create table t2_issue_582(i int, j int);
NOTICE:  Table doesn't have 'DISTRIBUTED BY' clause -- Using column named 'i' as the Apache Cloudberry data distribution key for this table.
HINT:  The 'DISTRIBUTED BY' clause determines the distribution of data. Make sure column(s) chosen are the optimal data distribution key to minimize skew.
create table t3_issue_582(i int, j int);
NOTICE:  Table doesn't have 'DISTRIBUTED BY' clause -- Using column named 'i' as the Apache Cloudberry data distribution key for this table.
HINT:  The 'DISTRIBUTED BY' clause determines the distribution of data. Make sure column(s) chosen are the optimal data distribution key to minimize skew.
create materialized view mv_t2_issue_582 as select j from t2_issue_582 where i = 1;
NOTICE:  Table doesn't have 'DISTRIBUTED BY' clause -- Using column(s) named 'j' as the Apache Cloudberry data distribution key for this table.
HINT:  The 'DISTRIBUTED BY' clause determines the distribution of data. Make sure column(s) chosen are the optimal data distribution key to minimize skew.
create rule r1 as on insert TO t1_issue_582 do also insert into t2_issue_582 values(1,1);
select count(*) from t1_issue_582;
 count 
-------
     0
(1 row)

select count(*) from t2_issue_582;
 count 
-------
     0
(1 row)

select mvname, datastatus from gp_matview_aux where mvname = 'mv_t2_issue_582';
     mvname      | datastatus 
-----------------+------------
 mv_t2_issue_582 | u
(1 row)

insert into t1_issue_582 values(1,1);
select count(*) from t1_issue_582;
 count 
-------
     1
(1 row)

select count(*) from t2_issue_582;
 count 
-------
     1
(1 row)

select mvname, datastatus from gp_matview_aux where mvname = 'mv_t2_issue_582';
     mvname      | datastatus 
-----------------+------------
 mv_t2_issue_582 | i
(1 row)

abort;
--
-- test issue https://github.com/apache/cloudberry/issues/582
-- test writable CTE
--
begin;
create table t_cte_issue_582(i int, j int);
NOTICE:  Table doesn't have 'DISTRIBUTED BY' clause -- Using column named 'i' as the Apache Cloudberry data distribution key for this table.
HINT:  The 'DISTRIBUTED BY' clause determines the distribution of data. Make sure column(s) chosen are the optimal data distribution key to minimize skew.
create materialized view mv_t_cte_issue_582 as select j from t_cte_issue_582 where i = 1;
NOTICE:  Table doesn't have 'DISTRIBUTED BY' clause -- Using column(s) named 'j' as the Apache Cloudberry data distribution key for this table.
HINT:  The 'DISTRIBUTED BY' clause determines the distribution of data. Make sure column(s) chosen are the optimal data distribution key to minimize skew.
select mvname, datastatus from gp_matview_aux where mvname = 'mv_t_cte_issue_582';
       mvname       | datastatus 
--------------------+------------
 mv_t_cte_issue_582 | u
(1 row)

with mod1 as (insert into t_cte_issue_582 values(1, 1) returning *) select * from mod1;
 i | j 
---+---
 1 | 1
(1 row)

select mvname, datastatus from gp_matview_aux where mvname = 'mv_t_cte_issue_582';
       mvname       | datastatus 
--------------------+------------
 mv_t_cte_issue_582 | e
(1 row)

abort;
-- test partitioned tables
create table par(a int, b int, c int) partition by range(b)
    subpartition by range(c) subpartition template (start (1) end (3) every (1))
    (start(1) end(3) every(1));
NOTICE:  Table doesn't have 'DISTRIBUTED BY' clause -- Using column named 'a' as the Apache Cloudberry data distribution key for this table.
HINT:  The 'DISTRIBUTED BY' clause determines the distribution of data. Make sure column(s) chosen are the optimal data distribution key to minimize skew.
insert into par values(1, 1, 1), (1, 1, 2), (2, 2, 1), (2, 2, 2);
create materialized view mv_par as select * from par;
NOTICE:  Table doesn't have 'DISTRIBUTED BY' clause -- Using column(s) named 'a' as the Apache Cloudberry data distribution key for this table.
HINT:  The 'DISTRIBUTED BY' clause determines the distribution of data. Make sure column(s) chosen are the optimal data distribution key to minimize skew.
create materialized view mv_par1 as select * from  par_1_prt_1;
NOTICE:  Table doesn't have 'DISTRIBUTED BY' clause -- Using column(s) named 'a' as the Apache Cloudberry data distribution key for this table.
HINT:  The 'DISTRIBUTED BY' clause determines the distribution of data. Make sure column(s) chosen are the optimal data distribution key to minimize skew.
create materialized view mv_par1_1 as select * from par_1_prt_1_2_prt_1;
NOTICE:  Table doesn't have 'DISTRIBUTED BY' clause -- Using column(s) named 'a' as the Apache Cloudberry data distribution key for this table.
HINT:  The 'DISTRIBUTED BY' clause determines the distribution of data. Make sure column(s) chosen are the optimal data distribution key to minimize skew.
create materialized view mv_par1_2 as select * from par_1_prt_1_2_prt_2;
NOTICE:  Table doesn't have 'DISTRIBUTED BY' clause -- Using column(s) named 'a' as the Apache Cloudberry data distribution key for this table.
HINT:  The 'DISTRIBUTED BY' clause determines the distribution of data. Make sure column(s) chosen are the optimal data distribution key to minimize skew.
create materialized view mv_par2 as select * from  par_1_prt_2;
NOTICE:  Table doesn't have 'DISTRIBUTED BY' clause -- Using column(s) named 'a' as the Apache Cloudberry data distribution key for this table.
HINT:  The 'DISTRIBUTED BY' clause determines the distribution of data. Make sure column(s) chosen are the optimal data distribution key to minimize skew.
create materialized view mv_par2_1 as select * from  par_1_prt_2_2_prt_1;
NOTICE:  Table doesn't have 'DISTRIBUTED BY' clause -- Using column(s) named 'a' as the Apache Cloudberry data distribution key for this table.
HINT:  The 'DISTRIBUTED BY' clause determines the distribution of data. Make sure column(s) chosen are the optimal data distribution key to minimize skew.
select mvname, datastatus from gp_matview_aux where mvname like 'mv_par%';
  mvname   | datastatus 
-----------+------------
 mv_par2   | u
 mv_par2_1 | u
 mv_par    | u
 mv_par1   | u
 mv_par1_1 | u
 mv_par1_2 | u
(6 rows)

insert into par_1_prt_1 values (1, 1, 1);
-- mv_par1* shoud be updated
select mvname, datastatus from gp_matview_aux where mvname like 'mv_par%';
  mvname   | datastatus 
-----------+------------
 mv_par2   | u
 mv_par2_1 | u
 mv_par1_2 | u
 mv_par1_1 | i
 mv_par1   | i
 mv_par    | i
(6 rows)

insert into par values (1, 2, 2);
-- mv_par* should be updated
select mvname, datastatus from gp_matview_aux where mvname like 'mv_par%';
  mvname   | datastatus 
-----------+------------
 mv_par2   | i
 mv_par2_1 | u
 mv_par1_2 | u
 mv_par1_1 | i
 mv_par1   | i
 mv_par    | i
(6 rows)

refresh materialized view mv_par;
refresh materialized view mv_par1;
refresh materialized view mv_par1_1;
refresh materialized view mv_par1_2;
refresh materialized view mv_par2;
refresh materialized view mv_par2_1;
begin;
insert into par_1_prt_2_2_prt_1 values (1, 2, 1);
-- mv_par1* should not be updated
select mvname, datastatus from gp_matview_aux where mvname like 'mv_par%';
  mvname   | datastatus 
-----------+------------
 mv_par2   | i
 mv_par2_1 | i
 mv_par1_2 | u
 mv_par1   | u
 mv_par1_1 | u
 mv_par    | i
(6 rows)

abort;
begin;
truncate par_1_prt_2;
-- mv_par1* should not be updated
select mvname, datastatus from gp_matview_aux where mvname like 'mv_par%';
  mvname   | datastatus 
-----------+------------
 mv_par2   | e
 mv_par2_1 | e
 mv_par1_2 | u
 mv_par1   | u
 mv_par1_1 | u
 mv_par    | e
(6 rows)

abort;
truncate par_1_prt_2;
-- mv_par1* should not be updated
select mvname, datastatus from gp_matview_aux where mvname like 'mv_par%';
  mvname   | datastatus 
-----------+------------
 mv_par2   | e
 mv_par2_1 | e
 mv_par1_2 | u
 mv_par1   | u
 mv_par1_1 | u
 mv_par    | e
(6 rows)

refresh materialized view mv_par;
refresh materialized view mv_par1;
refresh materialized view mv_par1_1;
refresh materialized view mv_par1_2;
refresh materialized view mv_par2;
refresh materialized view mv_par2_1;
vacuum full par_1_prt_1_2_prt_1;
select mvname, datastatus from gp_matview_aux where mvname like 'mv_par%';
  mvname   | datastatus 
-----------+------------
 mv_par2   | u
 mv_par2_1 | u
 mv_par1_2 | u
 mv_par1_1 | r
 mv_par1   | r
 mv_par    | r
(6 rows)

refresh materialized view mv_par;
refresh materialized view mv_par1;
refresh materialized view mv_par1_1;
refresh materialized view mv_par1_2;
refresh materialized view mv_par2;
refresh materialized view mv_par2_1;
vacuum full par;
-- all should be updated.
select mvname, datastatus from gp_matview_aux where mvname like 'mv_par%';
  mvname   | datastatus 
-----------+------------
 mv_par2   | r
 mv_par2_1 | r
 mv_par    | r
 mv_par1_2 | r
 mv_par1   | r
 mv_par1_1 | r
(6 rows)

refresh materialized view mv_par;
refresh materialized view mv_par1;
refresh materialized view mv_par1_1;
refresh materialized view mv_par1_2;
refresh materialized view mv_par2;
refresh materialized view mv_par2_1;
begin;
create table par_1_prt_1_2_prt_3  partition of par_1_prt_1 for values from  (3) to (4);
NOTICE:  table has parent, setting distribution columns to match parent table
-- update status when partition of
select mvname, datastatus from gp_matview_aux where mvname like 'mv_par%';
  mvname   | datastatus 
-----------+------------
 mv_par2   | u
 mv_par2_1 | u
 mv_par1_1 | u
 mv_par1_2 | u
 mv_par1   | e
 mv_par    | e
(6 rows)

abort;
begin;
drop table par_1_prt_1 cascade;
NOTICE:  drop cascades to 3 other objects
DETAIL:  drop cascades to materialized view mv_par1_1
drop cascades to materialized view mv_par1_2
drop cascades to materialized view mv_par1
-- update status when drop table 
select mvname, datastatus from gp_matview_aux where mvname like 'mv_par%';
  mvname   | datastatus 
-----------+------------
 mv_par2   | u
 mv_par2_1 | u
 mv_par    | e
(3 rows)

abort;
begin;
alter table par_1_prt_1 detach partition par_1_prt_1_2_prt_1;
-- update status when detach
select mvname, datastatus from gp_matview_aux where mvname like 'mv_par%';
  mvname   | datastatus 
-----------+------------
 mv_par2   | u
 mv_par2_1 | u
 mv_par1_1 | u
 mv_par1_2 | u
 mv_par1   | e
 mv_par    | e
(6 rows)

abort;
begin;
create table new_par(a int, b int, c int);
NOTICE:  Table doesn't have 'DISTRIBUTED BY' clause -- Using column named 'a' as the Apache Cloudberry data distribution key for this table.
HINT:  The 'DISTRIBUTED BY' clause determines the distribution of data. Make sure column(s) chosen are the optimal data distribution key to minimize skew.
-- update status when attach
alter table par_1_prt_1 attach partition new_par for values from (4) to (5);
select mvname, datastatus from gp_matview_aux where mvname like 'mv_par%';
  mvname   | datastatus 
-----------+------------
 mv_par2   | u
 mv_par2_1 | u
 mv_par1_1 | u
 mv_par1_2 | u
 mv_par1   | e
 mv_par    | e
(6 rows)

abort;
--
-- Maintain materialized views on partitioned tables from bottom to up.
--
insert into par values(1, 1, 1), (1, 1, 2), (2, 2, 1), (2, 2, 2);
refresh materialized view mv_par;
refresh materialized view mv_par1;
refresh materialized view mv_par1_1;
refresh materialized view mv_par1_2;
refresh materialized view mv_par2;
refresh materialized view mv_par2_1;
begin;
select mvname, datastatus from gp_matview_aux where mvname like 'mv_par%';
  mvname   | datastatus 
-----------+------------
 mv_par2   | u
 mv_par2_1 | u
 mv_par    | u
 mv_par1   | u
 mv_par1_1 | u
 mv_par1_2 | u
(6 rows)

insert into par values(1, 1, 1), (1, 1, 2);
select mvname, datastatus from gp_matview_aux where mvname like 'mv_par%';
  mvname   | datastatus 
-----------+------------
 mv_par2   | u
 mv_par2_1 | u
 mv_par1_1 | i
 mv_par1   | i
 mv_par    | i
 mv_par1_2 | i
(6 rows)

abort;
begin;
select mvname, datastatus from gp_matview_aux where mvname like 'mv_par%';
  mvname   | datastatus 
-----------+------------
 mv_par2   | u
 mv_par2_1 | u
 mv_par    | u
 mv_par1   | u
 mv_par1_1 | u
 mv_par1_2 | u
(6 rows)

insert into par_1_prt_2_2_prt_1 values(2, 2, 1);
select mvname, datastatus from gp_matview_aux where mvname like 'mv_par%';
  mvname   | datastatus 
-----------+------------
 mv_par2   | i
 mv_par2_1 | i
 mv_par1   | u
 mv_par1_1 | u
 mv_par1_2 | u
 mv_par    | i
(6 rows)

abort;
begin;
select mvname, datastatus from gp_matview_aux where mvname like 'mv_par%';
  mvname   | datastatus 
-----------+------------
 mv_par2   | u
 mv_par2_1 | u
 mv_par    | u
 mv_par1   | u
 mv_par1_1 | u
 mv_par1_2 | u
(6 rows)

delete from par where b = 2  and c = 1;
select mvname, datastatus from gp_matview_aux where mvname like 'mv_par%';
  mvname   | datastatus 
-----------+------------
 mv_par2   | e
 mv_par2_1 | e
 mv_par1   | u
 mv_par1_1 | u
 mv_par1_2 | u
 mv_par    | e
(6 rows)

abort;
begin;
select mvname, datastatus from gp_matview_aux where mvname like 'mv_par%';
  mvname   | datastatus 
-----------+------------
 mv_par2   | u
 mv_par2_1 | u
 mv_par    | u
 mv_par1   | u
 mv_par1_1 | u
 mv_par1_2 | u
(6 rows)

delete from par_1_prt_1_2_prt_2;
select mvname, datastatus from gp_matview_aux where mvname like 'mv_par%';
  mvname   | datastatus 
-----------+------------
 mv_par2   | u
 mv_par2_1 | u
 mv_par1_1 | u
 mv_par1_2 | e
 mv_par1   | e
 mv_par    | e
(6 rows)

abort;
-- Across partition update.
begin;
select mvname, datastatus from gp_matview_aux where mvname like 'mv_par%';
  mvname   | datastatus 
-----------+------------
 mv_par2   | u
 mv_par2_1 | u
 mv_par    | u
 mv_par1   | u
 mv_par1_1 | u
 mv_par1_2 | u
(6 rows)

update par set c = 2 where b = 1 and c = 1;
select mvname, datastatus from gp_matview_aux where mvname like 'mv_par%';
  mvname   | datastatus 
-----------+------------
 mv_par2   | u
 mv_par2_1 | u
 mv_par1_2 | i
 mv_par1_1 | e
 mv_par1   | e
 mv_par    | e
(6 rows)

abort;
-- Split Update with acrosss partition update.
begin;
select mvname, datastatus from gp_matview_aux where mvname like 'mv_par%';
  mvname   | datastatus 
-----------+------------
 mv_par2   | u
 mv_par2_1 | u
 mv_par    | u
 mv_par1   | u
 mv_par1_1 | u
 mv_par1_2 | u
(6 rows)

update par set c = 2, a = 2 where  b = 1 and c = 1;
select mvname, datastatus from gp_matview_aux where mvname like 'mv_par%';
  mvname   | datastatus 
-----------+------------
 mv_par2   | u
 mv_par2_1 | u
 mv_par1_2 | i
 mv_par1_1 | e
 mv_par1   | e
 mv_par    | e
(6 rows)

abort;
-- Test report warning if extend protocol data is not consumed.
--start_ignore
drop extension gp_inject_fault;
create extension gp_inject_fault;
--end_ignore
select gp_inject_fault_infinite('consume_extend_protocol_data', 'skip', dbid)
from gp_segment_configuration where role = 'p' and content = -1;
 gp_inject_fault_infinite 
--------------------------
 Success:
(1 row)

begin;
update par set c = 2 where b = 1 and c = 1;
WARNING:  fail to find leafs of partitioned table: par
end;
WARNING:  Extend Protocol Data unconsumed, subtag: 2
WARNING:  Extend Protocol Data unconsumed, subtag: 0
begin;
insert into par values(1, 1, 1), (1, 1, 2);
WARNING:  fail to find leafs of partitioned table: par
end;
WARNING:  Extend Protocol Data unconsumed, subtag: 0
begin;
update par set c = 2, a = 2 where  b = 1 and c = 1;
WARNING:  fail to find leafs of partitioned table: par
end;
WARNING:  Extend Protocol Data unconsumed, subtag: 2
WARNING:  Extend Protocol Data unconsumed, subtag: 0
begin;
insert into par values(1, 1, 1), (1, 1, 2), (2, 2, 1), (2, 2, 2);
WARNING:  fail to find leafs of partitioned table: par
delete from par_1_prt_1_2_prt_2;
end;
WARNING:  Extend Protocol Data unconsumed, subtag: 2
WARNING:  Extend Protocol Data unconsumed, subtag: 0
begin;
insert into par values(1, 1, 1), (1, 1, 2), (2, 2, 1), (2, 2, 2);
WARNING:  fail to find leafs of partitioned table: par
update par set c = 2, a = 2 where  b = 1 and c = 1;
WARNING:  fail to find leafs of partitioned table: par
end;
WARNING:  Extend Protocol Data unconsumed, subtag: 2
WARNING:  Extend Protocol Data unconsumed, subtag: 0
select gp_inject_fault('consume_extend_protocol_data', 'reset', dbid)
from gp_segment_configuration where role = 'p' and content = -1;
 gp_inject_fault 
-----------------
 Success:
(1 row)

--
-- End of Maintain materialized views on partitioned tables from bottom to up.
--
-- Test Rename matview.
begin;
create materialized view mv_name1 as
select * from par with no data;
NOTICE:  Table doesn't have 'DISTRIBUTED BY' clause -- Using column(s) named 'a' as the Apache Cloudberry data distribution key for this table.
HINT:  The 'DISTRIBUTED BY' clause determines the distribution of data. Make sure column(s) chosen are the optimal data distribution key to minimize skew.
select count(*) from gp_matview_aux where mvname = 'mv_name1';
 count 
-------
     1
(1 row)

alter materialized view mv_name1 rename to mv_name2;
select count(*) from gp_matview_aux where mvname = 'mv_name1';
 count 
-------
     0
(1 row)

select count(*) from gp_matview_aux where mvname = 'mv_name2';
 count 
-------
     1
(1 row)

abort;
-- start_ignore
CREATE EXTENSION IF NOT EXISTS gp_inject_fault;
NOTICE:  extension "gp_inject_fault" already exists, skipping
-- end_ignore
create table par_normal_oid(a int, b int) partition by range(a) using ao_row distributed randomly;
select gp_inject_fault('bump_oid', 'skip', dbid) from gp_segment_configuration where role = 'p' and content = -1;
 gp_inject_fault 
-----------------
 Success:
(1 row)

create table sub_par1_large_oid partition of par_normal_oid for values from (1) to (2) using ao_row;
NOTICE:  table has parent, setting distribution columns to match parent table
select 'sub_par1_large_oid'::regclass::oid > x'7FFFFFFF'::bigint;
 ?column? 
----------
 t
(1 row)

select gp_inject_fault('bump_oid', 'reset', dbid) from gp_segment_configuration where role = 'p' and content = -1;
 gp_inject_fault 
-----------------
 Success:
(1 row)

create materialized view mv_par_normal_oid as
    select count(*) from par_normal_oid;
NOTICE:  Table doesn't have 'DISTRIBUTED BY' clause -- Using column(s) named 'count' as the Apache Cloudberry data distribution key for this table.
HINT:  The 'DISTRIBUTED BY' clause determines the distribution of data. Make sure column(s) chosen are the optimal data distribution key to minimize skew.
select mvname, datastatus from gp_matview_aux where mvname = 'mv_par_normal_oid';
      mvname       | datastatus 
-------------------+------------
 mv_par_normal_oid | u
(1 row)

insert into par_normal_oid values(1, 2);
select mvname, datastatus from gp_matview_aux where mvname = 'mv_par_normal_oid';
      mvname       | datastatus 
-------------------+------------
 mv_par_normal_oid | i
(1 row)

--start_ignore
drop schema matview_data_schema cascade;
NOTICE:  drop cascades to 13 other objects
DETAIL:  drop cascades to table t2
drop cascades to table t3
drop cascades to materialized view mv3
drop cascades to table par
drop cascades to materialized view mv_par
drop cascades to materialized view mv_par1
drop cascades to materialized view mv_par1_1
drop cascades to materialized view mv_par1_2
drop cascades to materialized view mv_par2
drop cascades to materialized view mv_par2_1
drop cascades to extension gp_inject_fault
drop cascades to table par_normal_oid
drop cascades to materialized view mv_par_normal_oid
--end_ignore
reset enable_answer_query_using_materialized_views;
reset optimizer;
